{
  "schema_version": 1,
  "task_id": "repo-discovery-clip",
  "domain": "vision-language",
  "paper": "2103.00020v1",
  "title": "Learning Transferable Visual Models From Natural Language Supervision",
  "instructions": "Identify the canonical public implementation repository associated with this pinned paper revision. Write discovery.json containing a repository_url key whose value is the canonical HTTPS GitHub repository URL.",
  "tags": ["scientific-seed", "repository-discovery", "vision-language"],
  "expected_artifacts": ["discovery.json"],
  "checks": [{"type":"json_equals","artifact":"discovery.json","json_path":"repository_url","expected":"https://github.com/openai/CLIP"}],
  "timeout_seconds": 300,
  "metadata": {"benchmark_shard":"scientific-repository-discovery-v1","evidence_url":"https://arxiv.org/abs/2103.00020v1","scope":"paper-to-canonical-public-repository discovery only"}
}
