{
  "schema_version": 1,
  "task_id": "repo-discovery-swin-transformer",
  "domain": "vision-backbone",
  "paper": "2103.14030v2",
  "title": "Swin Transformer: Hierarchical Vision Transformer using Shifted Windows",
  "instructions": "Identify the canonical public implementation repository associated with this pinned paper revision. Write discovery.json containing a repository_url key whose value is the canonical HTTPS GitHub repository URL.",
  "tags": ["scientific-seed", "repository-discovery", "vision-backbone"],
  "expected_artifacts": ["discovery.json"],
  "checks": [{"type":"json_equals","artifact":"discovery.json","json_path":"repository_url","expected":"https://github.com/microsoft/Swin-Transformer"}],
  "timeout_seconds": 300,
  "metadata": {"benchmark_shard":"scientific-repository-discovery-v1","evidence_url":"https://arxiv.org/abs/2103.14030v2","scope":"paper-to-canonical-public-repository discovery only"}
}
