{
  "schema_version": 1,
  "task_id": "repo-discovery-quantum-hsgpq",
  "domain": "quantum-numerical-methods",
  "paper": "2502.14467v1",
  "title": "Provable Quantum Algorithm Advantage for Gaussian Process Quadrature",
  "instructions": "Identify the canonical public implementation repository associated with this pinned paper revision. Write discovery.json containing a repository_url key whose value is the canonical HTTPS GitHub repository URL.",
  "tags": ["scientific-seed", "repository-discovery", "quantum-numerical-methods"],
  "expected_artifacts": ["discovery.json"],
  "checks": [{"type":"json_equals","artifact":"discovery.json","json_path":"repository_url","expected":"https://github.com/cagalvisf/Quantum_HSGPQ"}],
  "timeout_seconds": 300,
  "metadata": {"benchmark_shard":"scientific-repository-discovery-v1","evidence_url":"https://arxiv.org/abs/2502.14467v1","scope":"paper-to-canonical-public-repository discovery only"}
}
