{
  "schema_version": 1,
  "task_id": "repo-discovery-adaaf-pinn",
  "domain": "scientific-ml-pde",
  "paper": "2308.04073v1",
  "title": "Learning Specialized Activation Functions for Physics-informed Neural Networks",
  "instructions": "Identify the canonical public implementation repository associated with this pinned paper revision. Write discovery.json containing a repository_url key whose value is the canonical HTTPS GitHub repository URL.",
  "tags": ["scientific-seed", "repository-discovery", "scientific-ml-pde"],
  "expected_artifacts": ["discovery.json"],
  "checks": [{"type":"json_equals","artifact":"discovery.json","json_path":"repository_url","expected":"https://github.com/LeapLabTHU/AdaAFforPINNs"}],
  "timeout_seconds": 300,
  "metadata": {"benchmark_shard":"scientific-repository-discovery-v1","evidence_url":"https://arxiv.org/abs/2308.04073v1","scope":"paper-to-canonical-public-repository discovery only"}
}
