{
  "schema_version": 1,
  "task_id": "repo-discovery-detr",
  "domain": "object-detection",
  "paper": "2005.12872v3",
  "title": "End-to-End Object Detection with Transformers",
  "instructions": "Identify the canonical public implementation repository associated with this pinned paper revision. Write discovery.json containing a repository_url key whose value is the canonical HTTPS GitHub repository URL.",
  "tags": ["scientific-seed", "repository-discovery", "object-detection"],
  "expected_artifacts": ["discovery.json"],
  "checks": [{"type":"json_equals","artifact":"discovery.json","json_path":"repository_url","expected":"https://github.com/facebookresearch/detr"}],
  "timeout_seconds": 300,
  "metadata": {"benchmark_shard":"scientific-repository-discovery-v1","evidence_url":"https://arxiv.org/abs/2005.12872v3","scope":"paper-to-canonical-public-repository discovery only"}
}
