{
  "schema_version": 1,
  "task_id": "repo-discovery-moby",
  "domain": "self-supervised-vision",
  "paper": "2105.04553v2",
  "title": "Self-Supervised Learning with Swin Transformers",
  "instructions": "Identify the canonical public implementation repository associated with this pinned paper revision. Write discovery.json containing a repository_url key whose value is the canonical HTTPS GitHub repository URL.",
  "tags": ["scientific-seed", "repository-discovery", "self-supervised-vision"],
  "expected_artifacts": ["discovery.json"],
  "checks": [{"type":"json_equals","artifact":"discovery.json","json_path":"repository_url","expected":"https://github.com/SwinTransformer/Transformer-SSL"}],
  "timeout_seconds": 300,
  "metadata": {"benchmark_shard":"scientific-repository-discovery-v1","evidence_url":"https://arxiv.org/abs/2105.04553v2","scope":"paper-to-canonical-public-repository discovery only"}
}
