{
  "schema_version": 1,
  "task_id": "repo-discovery-albert",
  "domain": "nlp-pretraining",
  "paper": "1909.11942v6",
  "title": "ALBERT: A Lite BERT for Self-supervised Learning of Language Representations",
  "instructions": "Identify the canonical public implementation repository associated with this pinned paper revision. Write discovery.json containing a repository_url key whose value is the canonical HTTPS GitHub repository URL.",
  "tags": ["scientific-seed", "repository-discovery", "nlp-pretraining"],
  "expected_artifacts": ["discovery.json"],
  "checks": [{"type":"json_equals","artifact":"discovery.json","json_path":"repository_url","expected":"https://github.com/google-research/albert"}],
  "timeout_seconds": 300,
  "metadata": {"benchmark_shard":"scientific-repository-discovery-v1","evidence_url":"https://arxiv.org/abs/1909.11942v6","scope":"paper-to-canonical-public-repository discovery only"}
}
