{
  "schema_version": 1,
  "task_id": "repo-discovery-lora",
  "domain": "nlp-adaptation",
  "paper": "2106.09685v2",
  "title": "LoRA: Low-Rank Adaptation of Large Language Models",
  "instructions": "Identify the canonical public implementation repository associated with this pinned paper revision. Write discovery.json containing a repository_url key whose value is the canonical HTTPS GitHub repository URL.",
  "tags": ["scientific-seed", "repository-discovery", "nlp-adaptation"],
  "expected_artifacts": ["discovery.json"],
  "checks": [{"type":"json_equals","artifact":"discovery.json","json_path":"repository_url","expected":"https://github.com/microsoft/LoRA"}],
  "timeout_seconds": 300,
  "metadata": {"benchmark_shard":"scientific-repository-discovery-v1","evidence_url":"https://arxiv.org/abs/2106.09685v2","scope":"paper-to-canonical-public-repository discovery only"}
}
