{
  "schema_version": 1,
  "task_id": "repo-discovery-improved-diffusion",
  "domain": "generative-vision",
  "paper": "2102.09672v1",
  "title": "Improved Denoising Diffusion Probabilistic Models",
  "instructions": "Identify the canonical public implementation repository associated with this pinned paper revision. Write discovery.json containing a repository_url key whose value is the canonical HTTPS GitHub repository URL.",
  "tags": ["scientific-seed", "repository-discovery", "generative-vision"],
  "expected_artifacts": ["discovery.json"],
  "checks": [{"type":"json_equals","artifact":"discovery.json","json_path":"repository_url","expected":"https://github.com/openai/improved-diffusion"}],
  "timeout_seconds": 300,
  "metadata": {"benchmark_shard":"scientific-repository-discovery-v1","evidence_url":"https://arxiv.org/abs/2102.09672v1","scope":"paper-to-canonical-public-repository discovery only"}
}
