{
  "schema_version": 1,
  "task_id": "repo-discovery-pysindy",
  "domain": "dynamical-systems",
  "paper": "2004.08424v1",
  "title": "PySINDy: A Python package for the Sparse Identification of Nonlinear Dynamics from Data",
  "instructions": "Identify the canonical public implementation repository associated with this pinned paper revision. Write discovery.json containing a repository_url key whose value is the canonical HTTPS GitHub repository URL.",
  "tags": ["scientific-seed", "repository-discovery", "dynamical-systems"],
  "expected_artifacts": ["discovery.json"],
  "checks": [{"type":"json_equals","artifact":"discovery.json","json_path":"repository_url","expected":"https://github.com/dynamicslab/pysindy"}],
  "timeout_seconds": 300,
  "metadata": {"benchmark_shard":"scientific-repository-discovery-v1","evidence_url":"https://arxiv.org/abs/2004.08424v1","scope":"paper-to-canonical-public-repository discovery only"}
}
